{
  "$schema": "./lifecycle-contract.schema.json",
  "schema_version": "ai-bim-lifecycle-contract/v1",
  "purpose": "Executable lifecycle contracts for the three coordinator-owned runtime state machines: review-session, endpoint-lease, and stage-binding. Each machine records the states, the observed runtime transitions, the shortcuts the runtime forbids, and the evidence a transition demands. scripts/lib/lifecycle_contracts.py validates the contract's internal consistency and keeps the declared state sets synchronized with the TypeScript source unions that own them.",
  "enforcement_note": "This contract describes the current coordinator-side runtime truth, not target intent. The gate proves three things only: the contract is a well-formed machine (reachable states, closed terminals, forbidden pairs have no direct edge, evidence references resolve), the declared state sets are byte-equal to the owning TypeScript union literals, and the readiness binding matches the architecture contract's review-session-ready policy. Transition behavior itself is enforced by each service's own runtime and tests; this gate does not execute the runtime. Kit-side stage loading states (loading_state idle|busy, runtime_state unchanged|changed_failed|changed_unconfirmed in bim-streaming-server stage_loading.py) are an observed surface and are out of this gate's scope.",
  "machines": [
    {
      "id": "review-session",
      "title": "Review session lifecycle",
      "owner_service": "bim-review-coordinator",
      "source_binding": {
        "file": "bim-review-coordinator/src/types.ts",
        "type_name": "SessionStatus"
      },
      "states": [
        {
          "id": "created",
          "kind": "initial",
          "description": "Session record exists without kit instance bindings. Entered at creation time when no kit capacity was bound."
        },
        {
          "id": "active",
          "kind": "initial",
          "description": "Session with kit instance bindings. Entered at creation time when bindings were allocated; there is no observed runtime transition from created to active, activation is decided when the record is created (sessionStore.create)."
        },
        {
          "id": "closing",
          "kind": "intermediate",
          "description": "Close has been accepted: viewer leases released and kit bindings marked draining. The close handler moves the session synchronously through closing to closed within one request; closing is not a resting state that outlives the handler."
        },
        {
          "id": "closed",
          "kind": "terminal",
          "description": "Kit bindings released, participants cleared, sessionClosed and kitInstanceReleased appended to the audit log."
        },
        {
          "id": "failed",
          "kind": "terminal",
          "runtime_write_path": "declared_only",
          "description": "Declared by the SessionStatus union but no runtime code path writes it: sessionStore.setStatus exists with zero callers. Recorded honestly as declared-only; wiring a real failure path is a future behavioral change that must be declared in a delta."
        }
      ],
      "transitions": [
        {
          "id": "close-from-created",
          "from": "created",
          "to": "closing",
          "trigger": "close-session",
          "evidence_required": [],
          "effects": [
            "release-viewer-leases",
            "drain-kit-bindings"
          ],
          "description": "POST close on a created session releases every active viewer lease and marks kit bindings draining before the status moves."
        },
        {
          "id": "close-from-active",
          "from": "active",
          "to": "closing",
          "trigger": "close-session",
          "evidence_required": [],
          "effects": [
            "release-viewer-leases",
            "drain-kit-bindings"
          ],
          "description": "POST close on an active session releases every active viewer lease and marks kit bindings draining before the status moves."
        },
        {
          "id": "finalize-close",
          "from": "closing",
          "to": "closed",
          "trigger": "close-session-finalize",
          "evidence_required": [],
          "effects": [
            "release-kit-bindings",
            "clear-participants"
          ],
          "description": "The same close handler synchronously releases kit bindings, clears participants, and appends sessionClosed plus kitInstanceReleased."
        }
      ],
      "forbidden_shortcuts": [
        {
          "id": "no-direct-close-from-created",
          "from": "created",
          "to": "closed",
          "reason": "A session must pass through closing so viewer leases are released and kit bindings are drained before release; skipping closing would leak leases and bindings.",
          "enforced_by": "The close handler is the only writer of closed and always writes closing first within the same request."
        },
        {
          "id": "no-direct-close-from-active",
          "from": "active",
          "to": "closed",
          "reason": "Same lease-release and binding-drain ordering as from created; closed may only follow closing.",
          "enforced_by": "The close handler is the only writer of closed and always writes closing first within the same request."
        }
      ],
      "evidence": [],
      "reentry_rules": [
        {
          "id": "close-idempotent",
          "states": [
            "closing",
            "closed"
          ],
          "trigger": "close-session",
          "behavior": "no-op-return-current-state",
          "description": "Repeated close on a closing or closed session returns the current record without appending duplicate audit events (append-only ledger cannot be cleaned afterwards)."
        }
      ],
      "notes": [
        "Session mutability gate: stage-binding and other runtime mutations require status in {created, active} (isSessionMutable); the runtime rejects others with session_lifecycle_blocked.",
        "There is no observed created-to-active transition: kit binding allocation happens at creation (store.create decides created vs active). A later activation path would be a behavioral state-machine change requiring a delta.",
        "failed is declared-only: the SessionStatus union declares it, but no caller writes it today."
      ]
    },
    {
      "id": "endpoint-lease",
      "title": "Viewer endpoint lease lifecycle",
      "owner_service": "bim-review-coordinator",
      "source_binding": {
        "file": "bim-review-coordinator/src/services/viewerLeaseStore.ts",
        "type_name": "ViewerLeaseStatus"
      },
      "states": [
        {
          "id": "active",
          "kind": "initial",
          "description": "Claimed lease bound to a kit instance endpoint. Claim enforces at most one active primary lease per session and replays idempotently on the same client nonce."
        },
        {
          "id": "released",
          "kind": "terminal",
          "description": "Explicitly released by the caller or cascaded from session close (releaseSession). Runtime authorization rejects it with lease_released."
        },
        {
          "id": "expired",
          "kind": "terminal",
          "description": "TTL elapsed without heartbeat; the sweep marks the lease expired lazily on the next store access. Runtime authorization rejects it with lease_expired."
        }
      ],
      "transitions": [
        {
          "id": "release-lease",
          "from": "active",
          "to": "released",
          "trigger": "release-lease",
          "evidence_required": [],
          "effects": [],
          "description": "Caller-initiated release; expires_at is clamped to the release instant."
        },
        {
          "id": "session-close-release",
          "from": "active",
          "to": "released",
          "trigger": "session-close-cascade",
          "evidence_required": [],
          "effects": [],
          "description": "Session close releases every active lease of that session before the session status moves to closing."
        },
        {
          "id": "ttl-expire",
          "from": "active",
          "to": "expired",
          "trigger": "ttl-sweep",
          "evidence_required": [],
          "effects": [],
          "description": "Lazy sweep on store access marks leases whose expires_at has passed; heartbeats extend expires_at and are not a state transition."
        }
      ],
      "forbidden_shortcuts": [
        {
          "id": "no-released-resurrection",
          "from": "released",
          "to": "active",
          "reason": "A released lease must never regain streaming authority; a new claim creates a new lease with a new token instead.",
          "enforced_by": "No store API writes active onto an existing lease; authorization rejects released leases with lease_released."
        },
        {
          "id": "no-expired-resurrection",
          "from": "expired",
          "to": "active",
          "reason": "An expired lease must never regain streaming authority; a new claim creates a new lease with a new token instead.",
          "enforced_by": "No store API writes active onto an existing lease; authorization rejects expired leases with lease_expired."
        }
      ],
      "evidence": [
        {
          "id": "datachannel-ready",
          "description": "Browser reported the Kit DataChannel is open, recorded on the lease by heartbeat.",
          "source": "viewerLeaseStore heartbeat field datachannel_ready"
        },
        {
          "id": "first-frame-at",
          "description": "First decoded video frame timestamp, set once by heartbeat and never overwritten.",
          "source": "viewerLeaseStore heartbeat field first_frame_at (monotonic set-once)"
        },
        {
          "id": "stage-matched",